{
  "kind": "knitlab-colorwork-chart",
  "version": 1,
  "title": "Four color checker",
  "width": 4,
  "height": 3,
  "rowNumbering": "bottom-up",
  "palette": [
    { "id": "natural", "name": "Natural", "hex": "#F4F0E6" },
    { "id": "red", "name": "Red", "hex": "#C2413A" },
    { "id": "gold", "name": "Gold", "hex": "#D6A633" },
    { "id": "navy", "name": "Navy", "hex": "#24415D" }
  ],
  "cells": [
    [3, 2, 1, 0],
    [0, 1, 2, 3],
    [1, 1, 3, 3]
  ]
}
